{
  "schema": "kingdom.karma-facet/v1",
  "kind": "offline-incident-legibility",
  "catalog_sha256": "ee751c456b3d2c7cf9f82a5b97698fbdf9b319e9ddf990b1440756ec1414dbc2",
  "playbook_sha256": "5753ac3dc00a9c8b262808b846b380c4dbd184e24452bb521dacb9052c85d5d7",
  "lineage": {
    "mode": "genesis",
    "previous_snapshot_sha256": null
  },
  "foresight_binding": {
    "scenario_sha256": "ca73d1baffe6e8453ae4c7ccae9177a2b396acf5d294bae4dfe1cdc4f6bd967b",
    "projection_sha256": "550395011c9aa9a96ae9fbd59fb11160756c5eb6b9c58910449b19421d0fd5c2",
    "constellation": "authority-laundering",
    "response_rung": "clarify"
  },
  "stimulus": "new-authored-claim",
  "review_request": "triage",
  "planes": {
    "observed": [
      {
        "fact_code": "authority-envelope-mismatch",
        "evidence_shape": "authority-envelope-review",
        "check_state": "unresolved"
      }
    ],
    "declared": {
      "scope_code": "delegated-tool-authority",
      "constellation": "authority-laundering",
      "alternative_hypothesis": "stale-or-ambiguous-delegation"
    },
    "inferred": {
      "system_effect_hypothesis": "capability-without-fresh-authority",
      "effect_established": false,
      "person_intent_inferred": false
    },
    "unknown": [
      "source-authenticity-unverified",
      "affected-scope-unverified",
      "authority-unverified"
    ]
  },
  "precommit": [
    {
      "safety_shim_code": "preserve-and-observe",
      "condition_state": "met"
    },
    {
      "safety_shim_code": "narrow-delegated-authority",
      "condition_state": "unknown"
    }
  ],
  "receipts": {
    "occurrence": null,
    "scope-authority": null,
    "evidence-integrity": null,
    "source-lineage": null,
    "counterevidence": null,
    "containment": null,
    "recovery": null,
    "privacy-release": null
  },
  "contract": {
    "assessment_unit": "one-authored-system-incident-claim",
    "incident_is_authored_not_detected": true,
    "occurrence_established": false,
    "source_authenticity_verified": false,
    "latest_state_established": false,
    "person_intent_inferred": false,
    "person_attributed": false,
    "identity_fields_allowed": false,
    "raw_evidence_allowed": false,
    "free_text_fields_allowed": false,
    "scores_or_severity": false,
    "automatic_detection": false,
    "automatic_alerting": false,
    "automatic_ticketing": false,
    "automatic_enforcement": false,
    "automatic_closure": false,
    "automatic_rule_update": false,
    "human_review_required_for_action": true,
    "owned_or_authorized_boundary_required": true,
    "retaliation": false,
    "hack_back": false,
    "executes_input": false,
    "executes_response": false,
    "publishes_output": false,
    "creates_external_effect": false
  },
  "budget": {
    "cards": 1,
    "stimuli": 1,
    "passes": 1,
    "observations_max": 4,
    "unknowns_max": 5,
    "precommits_max": 3,
    "receipt_slots": 8,
    "debt_entries": 8,
    "file_bytes_max": 32768,
    "decoded_nodes_max": 512,
    "nesting_depth_max": 8,
    "string_characters_max": 256,
    "output_bytes_max": 16384,
    "automatic_retries": 0,
    "clock_reads": 0,
    "random_draws": 0,
    "network_calls": 0,
    "external_messages": 0,
    "writes": 0,
    "subprocesses": 0,
    "model_calls": 0,
    "paid_calls": 0,
    "alerts": 0,
    "tickets": 0,
    "enforcements": 0,
    "publications": 0,
    "payload_bytes_retained": 0,
    "raw_evidence_bytes_retained": 0,
    "identity_records": 0,
    "cross_run_records": 0
  },
  "breach": {
    "state": "quarantined",
    "action": "stop-without-retry-or-result",
    "source_unchanged": true,
    "submitted_values_echoed": false,
    "submitted_paths_echoed": false,
    "partial_brief": false,
    "downstream_effects": false
  },
  "exit": {
    "action": "return-or-discard-one-brief",
    "state_retained": false,
    "history_retained": false,
    "standing_created": false,
    "authority_created": false,
    "closure_created": false,
    "publication_created": false,
    "follow_up": false
  },
  "non_claims": [
    "A Facet Brief is one bounded current declaration, not a complete incident record, log, timeline, alert, report, or source of truth.",
    "The O plane names an authored receipt shape; the compiler does not observe reality or verify that an event occurred.",
    "The compiler does not establish occurrence, source authenticity, effect, impact, cause, chronology, latest state, or root cause.",
    "The D and I planes do not prove intent, guilt, attribution, blame, identity, or any person's character or worth.",
    "The U plane is not adverse evidence; declared unknowns are finite and cannot establish that no other unknown exists.",
    "Safety Shims are reversible review candidates, not authorization, execution, enforcement, deployment, publication, or legal advice.",
    "Open Angles are system verification debt, never person debt, punishment, balance, score, rank, access, trust, or reputation; receipt-cited is not paid.",
    "A receipt digest can be correlating or a low-entropy oracle and is not proof of privacy, provenance, independence, truth, or custody.",
    "Return Fit and Repair Grain fields do not prove recovery, closure, recurrence, learning, adoption, or future conduct.",
    "No raw payload, evidence body, log, trace, prompt, address, identity, credential, target, command, URL, timestamp, free text, or cross-run profile is accepted or emitted."
  ]
}
